PRD-ID,SPEC-Path,Status,Severidade,Comentario
REQ-ACE-001,docs/SPEC/04-rbac-permissoes.md,Coberto,menor,A SPEC define obraId como escopo obrigatorio para entidades tenant-scoped e fecha o bypass controlado para SuperAdmin e Board alinhando isolamento por obra e visibilidade consolidada cross-tenant.
REQ-ACE-002,docs/SPEC/03-fila-scoring-estados-sla.md,Coberto,menor,A maquina de estados torna CONCLUIDA um estado terminal e a matriz de autorizacao explicita que nao ha mutacoes validas depois da conclusao.
REQ-ACE-003,docs/SPEC/03-fila-scoring-estados-sla.md,Coberto,menor,PRD e SPEC alinhados por DEC-001: alocacao manual determina operador destinatario mas demanda participa do scoring normalmente. Cenarios Gherkin reescritos com terminologia canonica.
REQ-ACE-004,docs/SPEC/03-fila-scoring-estados-sla.md,Coberto,menor,A auditoria administrativa exige registo nao destrutivo com ator timestamp valores antigo novo e justificativa obrigatoria para alteracoes gerenciais relevantes.
REQ-ACE-005,docs/SPEC/03-fila-scoring-estados-sla.md,Parcial,importante,O destaque visual de prioridade MAXIMA esta especificado mas a manutencao explicita das restantes demandas visiveis e rolaveis na UI mobile nao foi localizada no texto tecnico.
REQ-ACE-006,docs/SPEC/03-fila-scoring-estados-sla.md,Parcial,bloqueante,A SPEC cobre a transicao inicial para PENDENTE_APROVACAO mas acrescenta aprovacao automatica apos 24 horas sem decisao o que enfraquece a exigencia de revisao administrativa antes do encerramento definitivo.
REQ-ACE-007,docs/SPEC/00-visao-arquitetura.md,Parcial,importante,A arquitetura documenta access token de 15 minutos refresh token rotativo de 7 dias e blacklist por jti em Redis mas o criterio de aceite correspondente ainda nao esta migrado no PRD modular.
REQ-ACE-008,docs/SPEC/04-rbac-permissoes.md,Coberto,menor,O bypass cross-tenant auditado e a limitacao estrita de Board a HTTP GET com HTTP 403 para escrita estao claramente documentados.
