PRD-ID,SPEC-Path,Status,Severidade,Comentario
REQ-RBAC-001,docs/SPEC/04-rbac-permissoes.md,Coberto,menor,A SPEC define bypass multi-tenant visao transversal e auditoria de acessos cross-tenant para SuperAdmin.
REQ-RBAC-002,docs/SPEC/04-rbac-permissoes.md,Coberto,menor,O perfil Board esta limitado a leitura com bypass cross-tenant passivo e foco em analytics e dashboards.
REQ-RBAC-003,docs/SPEC/04-rbac-permissoes.md,Coberto,menor,A SPEC cobre atribuicao explicita por obra cadastros operacionais e alocacao manual de demandas para AdminOperacional.
REQ-RBAC-004,docs/SPEC/04-rbac-permissoes.md,Coberto,menor,A SPEC documenta visibilidade gerencial no tenant contestacoes e selecao manual de operador na criacao de demanda.
REQ-RBAC-005,docs/SPEC/04-rbac-permissoes.md,Parcial,importante,A autoria propria das demandas esta preservada mas a matriz tambem abre leituras de obra cadastros territoriais e catalogos operacionais alem da formulacao do PRD.
REQ-RBAC-006,docs/SPEC/04-rbac-permissoes.md,Parcial,importante,A SPEC restringe o operador a propria fila expediente e demandas alocadas mas nao explicita prioridades maximas em destaque no topo e adiciona leituras auxiliares.
